{"denominator":["fmt_gate","unit_gate"],"disposition_digest":"bbbbbbbbbbbbbbbbbbbbbbbbbbbbbbbbbbbbbbbbbbbbbbbbbbbbbbbbbbbbbbbb","expansion_fingerprint":"bbbbbbbbbbbbbbbbbbbbbbbbbbbbbbbbbbbbbbbbbbbbbbbbbbbbbbbbbbbbbbbb","included_native_tiers":["merge_gate","pr_fast"],"policy_digest":"cccccccccccccccccccccccccccccccccccccccccccccccccccccccccccccccc","producer":"xtask::ci_route_plan","requested_profile":"merge_gate","rows":[{"applicability":"applicable","gate_id":"fmt_gate","lifecycle":{"resolution":"current","state":"active"},"native_tier":"pr_fast","outcome":{"command":"run fmt_gate","kind":"run","reason":"selected by selector","timeout_seconds":60},"policy_role":"required","selector_placement":"selected","selector_role":"always_on"},{"applicability":"not_applicable","gate_id":"unit_gate","lifecycle":{"resolution":"current","state":"active"},"native_tier":"pr_fast","outcome":{"kind":"scoped_noop","reason":"scope selector decided","selector_digest":"aaaaaaaaaaaaaaaaaaaaaaaaaaaaaaaaaaaaaaaaaaaaaaaaaaaaaaaaaaaaaaaa"},"policy_role":"advisory","selector_placement":"skipped","selector_role":"rust_scoped"}],"schema":"ci_route_plan.v1","selection":{"base":"bbbbbbbbbbbbbbbbbbbbbbbbbbbbbbbbbbbbbbbb","fallback_used":false,"package_args":["-p","perl-parser"],"scope_ok":true,"selector_digest":"aaaaaaaaaaaaaaaaaaaaaaaaaaaaaaaaaaaaaaaaaaaaaaaaaaaaaaaaaaaaaaaa"},"semantic_fingerprint":"13019736ae2a19556b0c8d7157b8762da26407cecaf8fcf09582eb99aaa5d730","subject":{"base_sha":"bbbbbbbbbbbbbbbbbbbbbbbbbbbbbbbbbbbbbbbb","head_sha":"aaaaaaaaaaaaaaaaaaaaaaaaaaaaaaaaaaaaaaaa","kind":"pull_request","subject_digest":"aaaaaaaaaaaaaaaaaaaaaaaaaaaaaaaaaaaaaaaaaaaaaaaaaaaaaaaaaaaaaaaa"},"summary":{"by_policy_role":{"advisory":1,"required":1},"error":0,"governed":2,"quarantined":0,"run":1,"scoped_noop":1},"workflow_digest":"cccccccccccccccccccccccccccccccccccccccccccccccccccccccccccccccc"}